{"$id":"https://ai-film-master-guide.vercel.app/data/v1/schema/model-history.json","$schema":"http://json-schema.org/draft-07/schema#","description":"Watchtower 2.0 event log: dated status, price, tier, release, verification, and coverage events for every tracked model, plus the pricing baseline the drift engine diffs the live pricing table against. Hand-authored; preserved across API rebuilds. Every event traces to models.json, model-updates.md, or a pricing-table change shipped in the same wave.","properties":{"events":{"items":{"properties":{"after_usd":{"type":["number","null"]},"before_usd":{"type":["number","null"]},"confidence":{"type":"string"},"date":{"format":"date","type":"string"},"id":{"type":"string"},"kind":{"enum":["release","status","price","tier","verification","coverage"],"type":"string"},"model":{"type":"string"},"model_id":{"type":["string","null"]},"pct":{"type":"number"},"source":{"type":"string"},"status_after":{"type":"string"},"status_before":{"type":"string"},"summary":{"type":"string"},"tier":{"type":"string"},"unit":{"type":"string"}},"required":["id","date","model_id","model","kind","summary"],"type":"object"},"type":"array"},"format":{"const":"model-history/1.0","type":"string"},"generated_at":{"format":"date-time","type":"string"},"method":{"type":"string"},"pricing_baseline":{"properties":{"at":{"format":"date-time","type":"string"},"entries":{"items":{"properties":{"model":{"type":"string"},"model_id":{"type":"string"},"pricing_status":{"type":"string"},"tiers":{"items":{"properties":{"tier":{"type":"string"},"unit":{"type":"string"},"usd_high":{"type":"number"},"usd_low":{"type":"number"}},"required":["tier","unit","usd_low","usd_high"],"type":"object"},"type":"array"}},"required":["model_id","model","pricing_status","tiers"],"type":"object"},"type":"array"},"label":{"type":"string"}},"required":["at","label","entries"],"type":"object"}},"required":["format","generated_at","method","pricing_baseline","events"],"title":"ModelHistory","type":"object"}
