{
 "format": "model-history/1.0",
 "generated_at": "2026-10-13T12:36:00Z",
 "method": "Hand-authored event log. Every event traces to a fact recorded in models.json (what_changed), data/v1/model-updates.md, or this wave's own pricing-table changes. Price events carry a before/after pair only where the record documents both numbers; otherwise the fields are null and the summary says why. The pricing baseline below is the pricing table as curated on 2026-10-11 — the drift engine diffs the live table against it, so a rate that moves from here on is caught mechanically, not by memory.",
 "pricing_baseline": {
  "at": "2026-10-11T00:00:00Z",
  "label": "Pricing table as curated 2026-10-11 (Watchtower Wave A)",
  "entries": [
   {
    "model_id": "soul-2-0",
    "model": "Soul 2.0",
    "pricing_status": "live",
    "tiers": [
     {
      "tier": "image",
      "unit": "image",
      "usd_low": 0.0047,
      "usd_high": 0.0047
     }
    ]
   },
   {
    "model_id": "soul-cast",
    "model": "Soul Cast",
    "pricing_status": "live",
    "tiers": [
     {
      "tier": "image",
      "unit": "image",
      "usd_low": 0.0049,
      "usd_high": 0.0049
     }
    ]
   },
   {
    "model_id": "soul-cinema",
    "model": "Soul Cinema",
    "pricing_status": "unpublished",
    "tiers": []
   },
   {
    "model_id": "dop",
    "model": "DoP (Lite/Standard/Turbo)",
    "pricing_status": "live",
    "tiers": [
     {
      "tier": "lite-720p",
      "unit": "second",
      "usd_low": 0.0392,
      "usd_high": 0.0392
     },
     {
      "tier": "turbo-720p",
      "unit": "second",
      "usd_low": 0.0653,
      "usd_high": 0.0653
     },
     {
      "tier": "standard-720p",
      "unit": "second",
      "usd_low": 0.0915,
      "usd_high": 0.0915
     }
    ]
   },
   {
    "model_id": "marketing-studio-video",
    "model": "Marketing Studio video",
    "pricing_status": "live",
    "tiers": [
     {
      "tier": "video",
      "unit": "second",
      "usd_low": 0.196,
      "usd_high": 0.196
     }
    ]
   },
   {
    "model_id": "seedance-2-0",
    "model": "Seedance 2.0",
    "pricing_status": "live",
    "tiers": [
     {
      "tier": "720p",
      "unit": "second",
      "usd_low": 0.08,
      "usd_high": 0.08
     },
     {
      "tier": "1080p",
      "unit": "second",
      "usd_low": 0.37,
      "usd_high": 0.37
     }
    ]
   },
   {
    "model_id": "seedance-2-5",
    "model": "Seedance 2.5",
    "pricing_status": "live",
    "tiers": [
     {
      "tier": "480p",
      "unit": "second",
      "usd_low": 0.1028,
      "usd_high": 0.1028
     },
     {
      "tier": "720p",
      "unit": "second",
      "usd_low": 0.231,
      "usd_high": 0.2311
     },
     {
      "tier": "1080p",
      "unit": "second",
      "usd_low": 0.5686,
      "usd_high": 0.5686
     }
    ]
   },
   {
    "model_id": "seedance-3-0",
    "model": "Seedance 3.0",
    "pricing_status": "unpublished",
    "tiers": []
   },
   {
    "model_id": "kling-3-0",
    "model": "Kling 3.0",
    "pricing_status": "live",
    "tiers": [
     {
      "tier": "720p",
      "unit": "second",
      "usd_low": 0.084,
      "usd_high": 0.168
     },
     {
      "tier": "1080p",
      "unit": "second",
      "usd_low": 0.14,
      "usd_high": 0.14
     },
     {
      "tier": "4k",
      "unit": "second",
      "usd_low": 0.42,
      "usd_high": 0.42
     }
    ]
   },
   {
    "model_id": "kling-2-5-turbo",
    "model": "Kling 2.5 Turbo",
    "pricing_status": "live",
    "tiers": [
     {
      "tier": "720p",
      "unit": "second",
      "usd_low": 0.042,
      "usd_high": 0.042
     },
     {
      "tier": "1080p",
      "unit": "second",
      "usd_low": 0.07,
      "usd_high": 0.07
     }
    ]
   },
   {
    "model_id": "kling-4-0",
    "model": "Kling 4.0",
    "pricing_status": "unpublished",
    "tiers": []
   },
   {
    "model_id": "veo-3-1",
    "model": "Veo 3.1",
    "pricing_status": "live",
    "tiers": [
     {
      "tier": "standard-720p",
      "unit": "second",
      "usd_low": 0.4,
      "usd_high": 0.4
     },
     {
      "tier": "standard-1080p",
      "unit": "second",
      "usd_low": 0.4,
      "usd_high": 0.4
     },
     {
      "tier": "standard-4k",
      "unit": "second",
      "usd_low": 0.6,
      "usd_high": 0.6
     },
     {
      "tier": "fast-720p",
      "unit": "second",
      "usd_low": 0.15,
      "usd_high": 0.15
     },
     {
      "tier": "fast-1080p",
      "unit": "second",
      "usd_low": 0.15,
      "usd_high": 0.15
     },
     {
      "tier": "fast-4k",
      "unit": "second",
      "usd_low": 0.35,
      "usd_high": 0.35
     },
     {
      "tier": "lite-720p",
      "unit": "second",
      "usd_low": 0.05,
      "usd_high": 0.05
     },
     {
      "tier": "lite-1080p",
      "unit": "second",
      "usd_low": 0.08,
      "usd_high": 0.08
     },
     {
      "tier": "app-720p-1080p",
      "unit": "second",
      "usd_low": 0.392,
      "usd_high": 0.392
     }
    ]
   },
   {
    "model_id": "veo-3-1-fast",
    "model": "Veo 3.1 Fast / Veo 3",
    "pricing_status": "live",
    "tiers": [
     {
      "tier": "fast-4s",
      "unit": "second",
      "usd_low": 0.1568,
      "usd_high": 0.1568
     },
     {
      "tier": "veo-3-720p",
      "unit": "second",
      "usd_low": 0.2842,
      "usd_high": 0.2842
     },
     {
      "tier": "veo-3-fast",
      "unit": "second",
      "usd_low": 0.1078,
      "usd_high": 0.1078
     }
    ]
   },
   {
    "model_id": "gemini-omni",
    "model": "Gemini Omni",
    "pricing_status": "live",
    "tiers": [
     {
      "tier": "360p-draft",
      "unit": "second",
      "usd_low": 0.03,
      "usd_high": 0.03
     },
     {
      "tier": "720p",
      "unit": "second",
      "usd_low": 0.1,
      "usd_high": 0.1
     },
     {
      "tier": "1080p",
      "unit": "second",
      "usd_low": 0.15,
      "usd_high": 0.15
     },
     {
      "tier": "4k",
      "unit": "second",
      "usd_low": 0.3,
      "usd_high": 0.3
     }
    ]
   },
   {
    "model_id": "sora-2",
    "model": "Sora 2 / Pro / Max",
    "pricing_status": "discontinued",
    "tiers": []
   },
   {
    "model_id": "wan-2-6",
    "model": "Wan 2.6",
    "pricing_status": "live",
    "tiers": [
     {
      "tier": "480p",
      "unit": "second",
      "usd_low": 0.0392,
      "usd_high": 0.0392
     },
     {
      "tier": "720p",
      "unit": "second",
      "usd_low": 0.0549,
      "usd_high": 0.0549
     },
     {
      "tier": "1080p",
      "unit": "second",
      "usd_low": 0.0784,
      "usd_high": 0.0784
     }
    ]
   },
   {
    "model_id": "wan-3-0",
    "model": "Wan 3.0 / 3.0 Prime",
    "pricing_status": "live",
    "tiers": [
     {
      "tier": "480p",
      "unit": "second",
      "usd_low": 0.0392,
      "usd_high": 0.0392
     },
     {
      "tier": "720p",
      "unit": "second",
      "usd_low": 0.0686,
      "usd_high": 0.0686
     },
     {
      "tier": "1080p",
      "unit": "second",
      "usd_low": 0.1372,
      "usd_high": 0.1372
     },
     {
      "tier": "prime-480p",
      "unit": "second",
      "usd_low": 0.0588,
      "usd_high": 0.0588
     },
     {
      "tier": "prime-720p",
      "unit": "second",
      "usd_low": 0.1176,
      "usd_high": 0.1176
     },
     {
      "tier": "prime-1080p",
      "unit": "second",
      "usd_low": 0.2352,
      "usd_high": 0.2352
     },
     {
      "tier": "api-480p",
      "unit": "second",
      "usd_low": 0.05,
      "usd_high": 0.05
     }
    ]
   },
   {
    "model_id": "hailuo-2-3",
    "model": "Hailuo 02 / 2.3",
    "pricing_status": "live",
    "tiers": [
     {
      "tier": "768p",
      "unit": "second",
      "usd_low": 0.0467,
      "usd_high": 0.056
     },
     {
      "tier": "1080p",
      "unit": "second",
      "usd_low": 0.0817,
      "usd_high": 0.0817
     },
     {
      "tier": "fast-768p",
      "unit": "second",
      "usd_low": 0.0317,
      "usd_high": 0.032
     }
    ]
   },
   {
    "model_id": "minimax-h3",
    "model": "MiniMax H3",
    "pricing_status": "live",
    "tiers": [
     {
      "tier": "2k",
      "unit": "second",
      "usd_low": 0.13,
      "usd_high": 0.13
     },
     {
      "tier": "768p",
      "unit": "second",
      "usd_low": 0.08,
      "usd_high": 0.08
     },
     {
      "tier": "480p",
      "unit": "second",
      "usd_low": 0.038,
      "usd_high": 0.05
     },
     {
      "tier": "max-turbo-768p",
      "unit": "second",
      "usd_low": 0.04,
      "usd_high": 0.04
     },
     {
      "tier": "max-turbo-480p",
      "unit": "second",
      "usd_low": 0.025,
      "usd_high": 0.025
     }
    ]
   },
   {
    "model_id": "luma-ray-3-2",
    "model": "Luma App / Ray 3.2",
    "pricing_status": "live",
    "tiers": [
     {
      "tier": "360p",
      "unit": "second",
      "usd_low": 0.012,
      "usd_high": 0.012
     },
     {
      "tier": "720p",
      "unit": "second",
      "usd_low": 0.09,
      "usd_high": 0.09
     },
     {
      "tier": "1080p",
      "unit": "second",
      "usd_low": 0.24,
      "usd_high": 0.36
     }
    ]
   },
   {
    "model_id": "pika-2-5",
    "model": "Pika 2.5",
    "pricing_status": "unpublished",
    "tiers": []
   },
   {
    "model_id": "grok-imagine-1-5",
    "model": "Grok Imagine Video 1.5",
    "pricing_status": "live",
    "tiers": [
     {
      "tier": "lite-480p",
      "unit": "second",
      "usd_low": 0.02,
      "usd_high": 0.02
     },
     {
      "tier": "lite-720p",
      "unit": "second",
      "usd_low": 0.03,
      "usd_high": 0.03
     },
     {
      "tier": "lite-1080p",
      "unit": "second",
      "usd_low": 0.14,
      "usd_high": 0.14
     },
     {
      "tier": "flagship-480p",
      "unit": "second",
      "usd_low": 0.08,
      "usd_high": 0.08
     },
     {
      "tier": "flagship-720p",
      "unit": "second",
      "usd_low": 0.14,
      "usd_high": 0.14
     },
     {
      "tier": "flagship-1080p",
      "unit": "second",
      "usd_low": 0.25,